{
  "registry_id": "metric_registry_v1",
  "schema_version": 1,
  "description": "Official P0 semantic metric identities for claim_semantics_v2 evaluation-only slice.",
  "metrics": [
    {
      "canonical_name": "material_claim_recall.v2",
      "version": "v2",
      "formula": "count(material gold atoms receiving one-to-one match credit from an eligible extracted candidate) / count(material gold atoms)",
      "numerator_definition": "Distinct material gold atom IDs matched one-to-one to an eligible canonical extracted candidate via frozen allowed_matches after deterministic maximum-cardinality matching.",
      "denominator_definition": "Count of material gold atom rows in the frozen gold inventory for the evaluated asset.",
      "eligibility_population": "Evaluated assets with valid frozen gold, span, draft identity, materiality, and allowed match edges.",
      "canonical_evaluation_unit": "asset",
      "aggregation": "none; mandatory per evaluated asset/fixture in this slice",
      "missing_invalid_behavior": "INVALID when required gold, span, draft SHA-256, materiality, or match-edge identity is missing, inconsistent, or tampered; evaluation fails closed.",
      "zero_denominator_behavior": "N/A / undefined with explicit undefined_reason when zero material gold atoms; never silently 0 or 1.",
      "range_unit": "[0,1] ratio; raw integer numerator and denominator always persisted",
      "direction": "higher_is_better",
      "exact_meaning": "Extraction coverage of the independent material-claim inventory.",
      "explicit_non_meaning": "Does not measure evidence correctness, verifier correctness, semantic resolution, or factual accuracy.",
      "authority": "P0 semantic qualification pack",
      "provenance_requirements": "Human-adjudicated frozen fixture with draft_sha256, spans, material flags, allowed_matches, and candidate roles; no model-generated canonical IDs as independent truth.",
      "deterministic_fixture_reference": "evals/fixtures/claim_semantics_v2.json#ADV01",
      "hand_calculated_expected_result": {
        "numerator": 3,
        "denominator": 4,
        "value": 0.75,
        "undefined": false,
        "undefined_reason": null
      },
      "reference_implementation_requirements": "scripts/evaluate_claim_semantics_v2.py; MATCH_INELIGIBLE_ROLES={compound,fragment,qualifier_loss,invention}; forbidden-role allowed edges fail closed; deterministic ID-sorted matching.",
      "migration_versioning_rules": "v2 breaks v1 recall eligibility by adding qualifier_loss and invention to match-ineligible roles; v1 material_claim_recall remains historical and immutable."
    },
    {
      "canonical_name": "material_claim_unresolved_rate.v1",
      "version": "v1",
      "formula": "count(material gold atoms without validly verified final binding) / count(material gold atoms)",
      "numerator_definition": "Material gold atoms where any unresolved condition holds: omitted extraction, only weak final disposition, unverified gold label, forbidden-role-only representation, invalid evidence binding, binding not fully entailing the claim, or oracle-proven false verification.",
      "denominator_definition": "Count of material gold atom rows in the frozen gold inventory.",
      "eligibility_population": "Evaluated assets with valid frozen claim, evidence-binding, and identity provenance.",
      "canonical_evaluation_unit": "asset",
      "aggregation": "none; mandatory per evaluated asset/fixture in this slice",
      "missing_invalid_behavior": "INVALID when required claim/evidence/binding identity is missing or inconsistent; evaluation fails closed.",
      "zero_denominator_behavior": "N/A / undefined when zero material gold atoms.",
      "range_unit": "[0,1] ratio; raw integer numerator and denominator always persisted",
      "direction": "lower_is_better",
      "exact_meaning": "Fraction of independently identified material claims the system failed to defensibly resolve.",
      "explicit_non_meaning": "Does not measure emitted-row unverified rate, historical UVR, or factual error prevalence.",
      "authority": "P0 semantic qualification pack; required target 0 unresolved material atoms for automatic semantic PASS",
      "provenance_requirements": "Frozen gold_semantic_status, predicted_semantic_status on matched candidates, and evidence_bindings with valid and fully_entailed flags.",
      "deterministic_fixture_reference": "evals/fixtures/claim_semantics_v2.json#ADV01",
      "hand_calculated_expected_result": {
        "numerator": 3,
        "denominator": 4,
        "value": 0.75,
        "undefined": false,
        "undefined_reason": null
      },
      "reference_implementation_requirements": "scripts/evaluate_claim_semantics_v2.py; unresolved is downstream disposition not a fourth verifier label; human publication exceptions never remove atoms from numerator.",
      "migration_versioning_rules": "New P0 semantic metric; orthogonal to historical UVR_v1."
    },
    {
      "canonical_name": "material_false_verification_rate.v1",
      "version": "v1",
      "formula": "count(material gold weak-or-unverified cases predicted verified) / count(eligible material gold weak-or-unverified cases)",
      "numerator_definition": "Material gold atoms whose independent gold_semantic_status is weak or unverified and whose matched candidate predicted_semantic_status is verified.",
      "denominator_definition": "All material gold atoms with gold_semantic_status weak or unverified in the evaluated asset.",
      "eligibility_population": "Fixed independently labeled material claim/evidence cases with gold label weak or unverified.",
      "canonical_evaluation_unit": "asset",
      "aggregation": "none; mandatory per evaluated asset/fixture in this slice",
      "missing_invalid_behavior": "INVALID when required gold or prediction identity is missing; evaluation fails closed.",
      "zero_denominator_behavior": "N/A / undefined when zero eligible weak-or-unverified material cases; qualification pack inadequate for this metric.",
      "range_unit": "[0,1] ratio; raw integer numerator and denominator always persisted",
      "direction": "lower_is_better",
      "exact_meaning": "Unsafe promotion of known unresolved material cases into verified.",
      "explicit_non_meaning": "Does not measure precision among all predicted verified claims, extraction recall, or overall factual accuracy.",
      "authority": "P0 semantic safety qualification; raw false-verification count must be zero",
      "provenance_requirements": "Frozen gold_semantic_status and candidate predicted_semantic_status linked by allowed_matches.",
      "deterministic_fixture_reference": "evals/fixtures/claim_semantics_v2.json#ADV01",
      "hand_calculated_expected_result": {
        "numerator": 1,
        "denominator": 2,
        "value": 0.5,
        "undefined": false,
        "undefined_reason": null
      },
      "reference_implementation_requirements": "scripts/evaluate_claim_semantics_v2.py; count only material gold with gold label weak or unverified.",
      "migration_versioning_rules": "New P0 safety metric introduced with claim_semantics_v2."
    },
    {
      "canonical_name": "automatic_semantic_false_pass_rate.v1",
      "version": "v1",
      "formula": "count(oracle-failing assets with automatic route PASS) / count(eligible oracle-failing assets)",
      "numerator_definition": "Integrated assets whose semantic oracle requires FAIL (any unresolved material atom) but whose recorded automatic_route.decision is PASS.",
      "denominator_definition": "All eligible integrated assets whose independent semantic oracle says the asset must fail.",
      "eligibility_population": "Integrated assets with valid automatic route evidence and computable oracle disposition.",
      "canonical_evaluation_unit": "asset",
      "aggregation": "pack-level in this slice; duplicated on per-fixture results for traceability",
      "missing_invalid_behavior": "INVALID when route or oracle evidence is missing; evaluation fails closed.",
      "zero_denominator_behavior": "N/A / undefined when zero oracle-failing assets; safety pack inadequate.",
      "range_unit": "[0,1] ratio; raw integer numerator and denominator always persisted",
      "direction": "lower_is_better",
      "exact_meaning": "Direct integrated false-green frequency.",
      "explicit_non_meaning": "Does not measure prose quality, human utility, false rejection rate, or verifier-only classifier accuracy.",
      "authority": "P0 semantic safety qualification; numerator must be zero",
      "provenance_requirements": "Frozen automatic_route.decision and oracle semantic_pass derived from material_claim_unresolved_rate.v1.",
      "deterministic_fixture_reference": "evals/fixtures/claim_semantics_v2.json#ADV01",
      "hand_calculated_expected_result": {
        "numerator": 1,
        "denominator": 1,
        "value": 1.0,
        "undefined": false,
        "undefined_reason": null
      },
      "reference_implementation_requirements": "scripts/evaluate_claim_semantics_v2.py; oracle semantic_pass iff zero unresolved material atoms.",
      "migration_versioning_rules": "New P0 safety metric introduced with claim_semantics_v2."
    },
    {
      "canonical_name": "unverified_verifier_row_rate.UVR_v1",
      "version": "UVR_v1",
      "formula": "U / (V + W + U) where U, V, W are post-dedup emitted verifier row counts by status",
      "numerator_definition": "Count of post-dedup emitted verifier rows with status unverified.",
      "denominator_definition": "Sum of post-dedup emitted verifier rows with status verified, weak, or unverified.",
      "eligibility_population": "Assets with recorded post-dedup verifier_rows identity.",
      "canonical_evaluation_unit": "asset",
      "aggregation": "none; historical sidecar coexisting with new semantic metrics",